State,RTO,Variant,OEM,2024-01-31,2024-02-29,2024-03-31,2024-04-30,2024-05-31,2024-06-30,2024-07-31,2024-08-31,2024-09-30,2024-10-31,2024-11-30,2024-12-31
Madhya Pradesh,PANNA DTO - MP35,ICE,BAJAJ AUTO LTD,141,158,209,334,301,199,183,135,98,199,379,128
Madhya Pradesh,PANNA DTO - MP35,ICE,CLASSIC LEGENDS PVT LTD,0,0,0,0,1,0,0,0,0,0,0,0
Madhya Pradesh,PANNA DTO - MP35,ICE,HERO MOTOCORP LTD,332,385,529,"1,012",634,515,511,354,229,575,"1,378",233
Madhya Pradesh,PANNA DTO - MP35,ICE,HONDA MOTORCYCLE AND SCOOTER INDIA (P) LTD,81,113,99,192,144,126,154,91,104,164,434,100
Madhya Pradesh,PANNA DTO - MP35,ICE,INDIA YAMAHA MOTOR PVT LTD,5,0,3,3,2,1,1,2,2,1,9,0
Madhya Pradesh,PANNA DTO - MP35,ICE,ROYAL-ENFIELD (UNIT OF EICHER LTD),11,7,11,7,7,10,7,3,3,5,24,5
Madhya Pradesh,PANNA DTO - MP35,ICE,SUZUKI MOTORCYCLE INDIA PVT LTD,0,0,1,0,0,2,0,1,1,1,2,0
Madhya Pradesh,PANNA DTO - MP35,ICE,TVS MOTOR COMPANY LTD,147,154,199,286,247,180,198,140,133,364,600,174
