State,RTO,Variant,OEM,2024-01-31,2024-02-29,2024-03-31,2024-04-30,2024-05-31,2024-06-30,2024-07-31,2024-08-31,2024-09-30,2024-10-31,2024-11-30,2024-12-31
Madhya Pradesh,MORENA DTO - MP6,ICE,BAJAJ AUTO LTD,356,345,447,667,310,325,310,368,259,586,602,214
Madhya Pradesh,MORENA DTO - MP6,ICE,CLASSIC LEGENDS PVT LTD,0,0,0,0,0,0,1,0,0,0,0,0
Madhya Pradesh,MORENA DTO - MP6,ICE,HERO MOTOCORP LTD,836,"1,159","1,036","1,839",672,797,676,643,382,"1,567","1,866",350
Madhya Pradesh,MORENA DTO - MP6,ICE,HONDA MOTORCYCLE AND SCOOTER INDIA (P) LTD,107,141,121,210,138,124,154,113,91,268,287,89
Madhya Pradesh,MORENA DTO - MP6,ICE,INDIA KAWASAKI MOTORS PVT LTD,0,0,0,0,0,0,0,0,0,1,0,0
Madhya Pradesh,MORENA DTO - MP6,ICE,INDIA YAMAHA MOTOR PVT LTD,2,1,4,5,4,7,6,5,1,8,3,1
Madhya Pradesh,MORENA DTO - MP6,ICE,ROYAL-ENFIELD (UNIT OF EICHER LTD),5,4,8,27,10,11,10,13,11,29,28,10
Madhya Pradesh,MORENA DTO - MP6,ICE,SUZUKI MOTORCYCLE INDIA PVT LTD,43,69,28,36,44,34,37,34,31,73,60,10
Madhya Pradesh,MORENA DTO - MP6,ICE,TVS MOTOR COMPANY LTD,116,159,233,287,141,152,187,116,102,258,308,89
