State,RTO,Variant,OEM,2024-01-31,2024-02-29,2024-03-31,2024-04-30,2024-05-31,2024-06-30,2024-07-31,2024-08-31,2024-09-30,2024-10-31,2024-11-30,2024-12-31
Madhya Pradesh,DAMOH DTO - MP34,ICE,BAJAJ AUTO LTD,179,190,180,416,208,176,165,143,117,227,699,148
Madhya Pradesh,DAMOH DTO - MP34,ICE,BMW INDIA PVT LTD,0,0,0,0,0,1,0,0,0,0,0,0
Madhya Pradesh,DAMOH DTO - MP34,ICE,HERO MOTOCORP LTD,293,326,387,633,436,320,332,309,168,492,"1,210",253
Madhya Pradesh,DAMOH DTO - MP34,ICE,HONDA MOTORCYCLE AND SCOOTER INDIA (P) LTD,170,130,179,342,207,194,142,164,93,188,751,129
Madhya Pradesh,DAMOH DTO - MP34,ICE,INDIA YAMAHA MOTOR PVT LTD,13,7,5,9,8,10,9,13,7,6,12,6
Madhya Pradesh,DAMOH DTO - MP34,ICE,ROYAL-ENFIELD (UNIT OF EICHER LTD),19,10,17,24,13,10,19,9,9,31,48,7
Madhya Pradesh,DAMOH DTO - MP34,ICE,SUZUKI MOTORCYCLE INDIA PVT LTD,22,23,22,29,30,23,41,32,22,62,36,16
Madhya Pradesh,DAMOH DTO - MP34,ICE,TVS MOTOR COMPANY LTD,190,189,204,347,288,195,178,151,102,223,617,169
