State,RTO,Variant,OEM,2025-01-31,2025-02-28,2025-03-31,2025-04-30,2025-05-31,2025-06-30,2025-07-31,2025-08-31,2025-09-30,2025-10-31,2025-11-30
Madhya Pradesh,BHIND DTO - MP30,L3G,ALTIER ELECTRIC VEHICLES PVT LTD,0,0,0,1,0,0,0,1,0,0,0
Madhya Pradesh,BHIND DTO - MP30,L3G,BEST WAY AGENCIES PVT LTD,1,0,0,0,0,0,0,1,0,0,0
Madhya Pradesh,BHIND DTO - MP30,L3G,DILLI ELECTRIC AUTO PVT LTD,1,1,2,1,6,2,0,13,0,0,0
Madhya Pradesh,BHIND DTO - MP30,L3G,ENERGY ELECTRIC VEHICLES,1,0,0,1,0,1,0,3,0,0,0
Madhya Pradesh,BHIND DTO - MP30,L3G,SATHI MOTORS ELECTRIC VEHICLE PVT LTD,0,0,0,2,1,6,0,9,0,0,0
Madhya Pradesh,BHIND DTO - MP30,L3G,SHRI BARSANA E-VEHICLES PVT LTD,0,0,0,0,0,1,0,1,0,0,0
Madhya Pradesh,BHIND DTO - MP30,L3G,T U K INDUSTRIES,0,3,1,0,1,2,0,7,0,0,0
Madhya Pradesh,BHIND DTO - MP30,L3G,TWO FRIENDS AUTO ELECTRIC PVT LTD,0,0,0,0,1,0,0,1,0,0,0
