State,RTO,Variant,OEM,2025-01-31,2025-02-28,2025-03-31,2025-04-30,2025-05-31,2025-06-30,2025-07-31,2025-08-31,2025-09-30,2025-10-31,2025-11-30
Madhya Pradesh,SHIVPURI DTO - MP33,L5G,BAXY LTD,0,0,0,0,0,0,0,0,0,0,1
Madhya Pradesh,SHIVPURI DTO - MP33,L5G,DE EUSI MOTORS PVT LTD.,0,0,0,0,0,1,0,1,1,2,1
Madhya Pradesh,SHIVPURI DTO - MP33,L5G,JMT VEHICLES PVT LTD,0,0,0,2,0,0,0,0,2,0,0
Madhya Pradesh,SHIVPURI DTO - MP33,L5G,J. S. AUTO (P) LTD,0,0,1,0,0,0,0,0,0,0,0
Madhya Pradesh,SHIVPURI DTO - MP33,L5G,MAHINDRA LAST MILE MOBILITY LTD,0,0,0,0,0,0,0,0,0,2,1
Madhya Pradesh,SHIVPURI DTO - MP33,L5G,SAERA ELECTRIC AUTO PVT LTD,0,0,0,0,0,0,0,0,0,0,0
