State,RTO,Variant,OEM,2025-01-31,2025-02-28,2025-03-31,2025-04-30,2025-05-31,2025-06-30,2025-07-31,2025-08-31,2025-09-30,2025-10-31,2025-11-30
Madhya Pradesh,HOSANGABAD DTO - MP5,ICE,BAJAJ AUTO LTD,244,242,173,294,389,181,2,"1,525",0,0,0
Madhya Pradesh,HOSANGABAD DTO - MP5,ICE,CLASSIC LEGENDS PVT LTD,1,0,0,0,0,0,0,1,0,0,0
Madhya Pradesh,HOSANGABAD DTO - MP5,ICE,HERO MOTOCORP LTD,379,330,294,438,471,263,7,"2,182",0,0,0
Madhya Pradesh,HOSANGABAD DTO - MP5,ICE,HONDA MOTORCYCLE AND SCOOTER INDIA (P) LTD,380,350,279,505,517,319,20,"2,370",0,0,0
Madhya Pradesh,HOSANGABAD DTO - MP5,ICE,INDIA YAMAHA MOTOR PVT LTD,13,8,5,1,4,4,1,36,0,0,0
Madhya Pradesh,HOSANGABAD DTO - MP5,ICE,ROYAL-ENFIELD (UNIT OF EICHER LTD),53,40,28,35,59,33,0,248,0,0,0
Madhya Pradesh,HOSANGABAD DTO - MP5,ICE,SUZUKI MOTORCYCLE INDIA PVT LTD,32,25,30,38,26,35,3,189,0,0,0
Madhya Pradesh,HOSANGABAD DTO - MP5,ICE,TVS MOTOR COMPANY LTD,227,188,151,216,251,179,10,"1,222",0,0,0
