State,RTO,Variant,OEM,2024-01-31,2024-02-29,2024-03-31,2024-04-30,2024-05-31,2024-06-30,2024-07-31,2024-08-31,2024-09-30,2024-10-31,2024-11-30,2024-12-31
Madhya Pradesh,PANNA DTO - MP35,E2W,BAJAJ AUTO LTD,0,0,0,0,0,0,0,0,0,1,0,0
Madhya Pradesh,PANNA DTO - MP35,E2W,GREAVES ELECTRIC MOBILITY PVT LTD,0,1,0,0,0,0,1,0,0,0,0,0
Madhya Pradesh,PANNA DTO - MP35,E2W,HERO MOTOCORP LTD,0,0,0,0,0,0,0,0,0,1,4,0
Madhya Pradesh,PANNA DTO - MP35,E2W,KLB KOMAKI PVT LTD,0,0,0,0,0,0,1,0,0,0,0,0
Madhya Pradesh,PANNA DTO - MP35,E2W,OLA ELECTRIC TECHNOLOGIES PVT LTD,5,7,9,4,8,8,12,1,3,10,6,3
Madhya Pradesh,PANNA DTO - MP35,E2W,TVS MOTOR COMPANY LTD,0,1,0,1,1,1,1,0,5,6,2,2
