State,RTO,Variant,OEM,2024-01-31,2024-02-29,2024-03-31,2024-04-30,2024-05-31,2024-06-30,2024-07-31,2024-08-31,2024-09-30,2024-10-31,2024-11-30,2024-12-31
Madhya Pradesh,KHARGONE ARTO - MP10,E2W,ATHER ENERGY LTD,1,0,0,0,0,0,0,0,0,0,0,1
Madhya Pradesh,KHARGONE ARTO - MP10,E2W,BAJAJ AUTO LTD,0,0,0,0,0,0,0,1,0,1,4,0
Madhya Pradesh,KHARGONE ARTO - MP10,E2W,BATTRE ELECTRIC MOBLITY PVT LTD,2,0,4,0,0,0,1,0,1,1,1,0
Madhya Pradesh,KHARGONE ARTO - MP10,E2W,ENGTIAN ELECTRIC BIKE PVT LTD,0,0,0,0,1,0,0,0,0,0,0,0
Madhya Pradesh,KHARGONE ARTO - MP10,E2W,OLA ELECTRIC TECHNOLOGIES PVT LTD,13,14,18,10,12,15,16,4,7,11,12,7
Madhya Pradesh,KHARGONE ARTO - MP10,E2W,TVS MOTOR COMPANY LTD,1,1,0,0,0,0,1,5,5,22,13,6
Madhya Pradesh,KHARGONE ARTO - MP10,E2W,WUXI NOOMA (IMPORTER: SMARTNK  ELECTRIC VEHICLE),0,0,0,0,0,0,0,0,0,0,0,2
