State,RTO,Variant,OEM,2025-01-31,2025-02-28,2025-03-31,2025-04-30,2025-05-31,2025-06-30,2025-07-31,2025-08-31,2025-09-30,2025-10-31,2025-11-30
Assam,NAGAON - AS2,E2W,ATHER ENERGY LTD,0,0,0,0,0,0,0,0,0,1,1
Assam,NAGAON - AS2,E2W,BAJAJ AUTO LTD,1,5,2,4,4,1,2,2,2,1,2
Assam,NAGAON - AS2,E2W,GREAVES ELECTRIC MOBILITY PVT LTD,1,0,0,0,0,0,0,1,1,0,0
Assam,NAGAON - AS2,E2W,HERO MOTOCORP LTD,0,0,2,1,2,2,1,2,3,5,6
Assam,NAGAON - AS2,E2W,KLB KOMAKI PVT LTD,0,0,0,1,0,0,1,0,0,0,0
Assam,NAGAON - AS2,E2W,OKINAWA AUTOTECH PVT LTD,0,6,1,0,0,4,0,3,0,0,0
Assam,NAGAON - AS2,E2W,OLA ELECTRIC TECHNOLOGIES PVT LTD,8,7,8,13,12,15,18,20,10,15,9
Assam,NAGAON - AS2,E2W,TVS MOTOR COMPANY LTD,2,0,1,3,3,2,2,6,0,5,2
