State,RTO,Variant,OEM,2025-01-31,2025-02-28,2025-03-31,2025-04-30,2025-05-31,2025-06-30,2025-07-31,2025-08-31,2025-09-30,2025-10-31,2025-11-30
Chhattisgarh,Rajnandgaon ARTO - CG8,ICE,BAJAJ AUTO LTD,270,168,109,215,199,161,0,"1,122",0,0,0
Chhattisgarh,Rajnandgaon ARTO - CG8,ICE,BMW INDIA PVT LTD,0,0,0,1,0,0,0,1,0,0,0
Chhattisgarh,Rajnandgaon ARTO - CG8,ICE,HERO MOTOCORP LTD,735,630,843,812,533,579,2,"4,134",0,0,0
Chhattisgarh,Rajnandgaon ARTO - CG8,ICE,HONDA MOTORCYCLE AND SCOOTER INDIA (P) LTD,784,699,729,774,596,505,28,"4,115",0,0,0
Chhattisgarh,Rajnandgaon ARTO - CG8,ICE,INDIA YAMAHA MOTOR PVT LTD,28,20,25,24,19,16,11,143,0,0,0
Chhattisgarh,Rajnandgaon ARTO - CG8,ICE,ROYAL-ENFIELD (UNIT OF EICHER LTD),34,31,43,33,36,28,0,205,0,0,0
Chhattisgarh,Rajnandgaon ARTO - CG8,ICE,SUZUKI MOTORCYCLE INDIA PVT LTD,25,30,31,32,28,25,0,171,0,0,0
Chhattisgarh,Rajnandgaon ARTO - CG8,ICE,TVS MOTOR COMPANY LTD,314,248,294,295,275,267,9,"1,702",0,0,0
