State,RTO,Variant,OEM,2024-01-31,2024-02-29,2024-03-31,2024-04-30,2024-05-31,2024-06-30,2024-07-31,2024-08-31,2024-09-30,2024-10-31,2024-11-30,2024-12-31
Chhattisgarh,Ambikapur RTO - CG15,L3G,ATUL AUTO LTD,0,2,0,1,0,0,0,0,0,0,0,0
Chhattisgarh,Ambikapur RTO - CG15,L3G,DILLI ELECTRIC AUTO PVT LTD,0,1,1,0,0,0,0,0,1,0,1,0
Chhattisgarh,Ambikapur RTO - CG15,L3G,G.K E-VEHICLS INDUSTRIES PVT LTD,0,0,0,0,0,0,0,0,0,0,2,0
Chhattisgarh,Ambikapur RTO - CG15,L3G,JAJODIA COMMODITIES PVT LTD,1,0,0,0,1,0,0,0,0,0,0,0
Chhattisgarh,Ambikapur RTO - CG15,L3G,SAERA ELECTRIC AUTO PVT LTD,0,3,2,0,0,0,4,0,0,0,0,0
Chhattisgarh,Ambikapur RTO - CG15,L3G,SKS TRADE INDIA PVT LTD,0,0,0,0,0,0,0,3,1,0,0,0
Chhattisgarh,Ambikapur RTO - CG15,L3G,YC ELECTRIC VEHICLE,0,2,1,4,1,1,0,3,1,2,0,2
