State,RTO,Variant,OEM,2025-01-31,2025-02-28,2025-03-31,2025-04-30,2025-05-31,2025-06-30,2025-07-31,2025-08-31,2025-09-30,2025-10-31,2025-11-30
Chhattisgarh,Narayanpur DTO - CG21,ICE,BAJAJ AUTO LTD,15,10,13,9,6,12,0,65,0,0,0
Chhattisgarh,Narayanpur DTO - CG21,ICE,HERO MOTOCORP LTD,103,98,86,95,91,112,5,590,0,0,0
Chhattisgarh,Narayanpur DTO - CG21,ICE,HONDA MOTORCYCLE AND SCOOTER INDIA (P) LTD,128,89,101,61,84,118,0,581,0,0,0
Chhattisgarh,Narayanpur DTO - CG21,ICE,ROYAL-ENFIELD (UNIT OF EICHER LTD),3,3,0,1,1,1,0,9,0,0,0
Chhattisgarh,Narayanpur DTO - CG21,ICE,SUZUKI MOTORCYCLE INDIA PVT LTD,0,0,1,0,1,1,0,3,0,0,0
Chhattisgarh,Narayanpur DTO - CG21,ICE,TVS MOTOR COMPANY LTD,23,12,17,14,15,15,0,96,0,0,0
