State,RTO,Variant,OEM,2024-01-31,2024-02-29,2024-03-31,2024-04-30,2024-05-31,2024-06-30,2024-07-31,2024-08-31,2024-09-30,2024-10-31,2024-11-30,2024-12-31
Chhattisgarh,KANKER DTO - CG19,ICE,BAJAJ AUTO LTD,141,104,117,112,128,112,75,100,80,101,231,68
Chhattisgarh,KANKER DTO - CG19,ICE,CLASSIC LEGENDS PVT LTD,0,0,0,0,0,0,0,1,0,0,0,0
Chhattisgarh,KANKER DTO - CG19,ICE,HERO MOTOCORP LTD,545,490,518,369,487,513,374,346,275,472,787,321
Chhattisgarh,KANKER DTO - CG19,ICE,HONDA MOTORCYCLE AND SCOOTER INDIA (P) LTD,348,348,466,304,489,519,432,354,231,539,969,384
Chhattisgarh,KANKER DTO - CG19,ICE,INDIA YAMAHA MOTOR PVT LTD,9,10,5,6,7,5,4,7,5,6,16,3
Chhattisgarh,KANKER DTO - CG19,ICE,ROYAL-ENFIELD (UNIT OF EICHER LTD),16,10,12,13,17,13,8,7,6,17,14,6
Chhattisgarh,KANKER DTO - CG19,ICE,SUZUKI MOTORCYCLE INDIA PVT LTD,63,41,58,54,70,51,61,33,73,74,146,53
Chhattisgarh,KANKER DTO - CG19,ICE,TVS MOTOR COMPANY LTD,204,179,195,172,200,187,140,89,87,263,254,123
