State,RTO,Variant,OEM,2024-01-31,2024-02-29,2024-03-31,2024-04-30,2024-05-31,2024-06-30,2024-07-31,2024-08-31,2024-09-30,2024-10-31,2024-11-30,2024-12-31
Chhattisgarh,Mahasamund DTO - CG6,L3G,BAXY LTD,0,0,0,0,0,2,0,0,0,0,0,0
Chhattisgarh,Mahasamund DTO - CG6,L3G,BEST WAY AGENCIES PVT LTD,0,0,0,1,0,0,0,0,0,0,0,0
Chhattisgarh,Mahasamund DTO - CG6,L3G,DILLI ELECTRIC AUTO PVT LTD,1,0,0,0,0,0,0,0,0,0,1,0
Chhattisgarh,Mahasamund DTO - CG6,L3G,G.K E-VEHICLS INDUSTRIES PVT LTD,0,0,0,0,0,0,0,1,2,5,9,6
Chhattisgarh,Mahasamund DTO - CG6,L3G,SAERA ELECTRIC AUTO PVT LTD,0,0,0,0,0,2,0,1,0,0,0,0
Chhattisgarh,Mahasamund DTO - CG6,L3G,SAHNIANAND E VEHICLES PVT LTD,0,1,0,0,1,0,0,1,0,0,0,1
Chhattisgarh,Mahasamund DTO - CG6,L3G,SHAKTI AUTO GREEN,0,0,0,0,0,0,1,0,0,0,0,0
Chhattisgarh,Mahasamund DTO - CG6,L3G,SUPERTECH EV LIMITED,0,0,0,0,1,1,5,0,1,0,0,0
