State,RTO,Variant,OEM,2025-01-31,2025-02-28,2025-03-31,2025-04-30,2025-05-31,2025-06-30,2025-07-31,2025-08-31,2025-09-30,2025-10-31,2025-11-30
Uttar Pradesh,Sitapur - UP34,L5P,BAJAJ AUTO LTD,2,1,3,0,9,6,0,21,0,0,0
Uttar Pradesh,Sitapur - UP34,L5P,EULER MOTORS PVT LTD,0,0,0,1,0,0,0,1,0,0,0
Uttar Pradesh,Sitapur - UP34,L5P,MAHINDRA LAST MILE MOBILITY LTD,25,25,24,28,56,50,4,212,0,0,0
Uttar Pradesh,Sitapur - UP34,L5P,OKAYA POWER PVT LTD,2,0,2,1,1,0,0,6,0,0,0
Uttar Pradesh,Sitapur - UP34,L5P,RASANDIK ENGINEERING INDUSTRIES INDIA LTD,0,0,1,0,0,0,0,1,0,0,0
Uttar Pradesh,Sitapur - UP34,L5P,TI CLEAN MOBILITY PVT LTD,0,0,1,0,0,0,0,1,0,0,0
Uttar Pradesh,Sitapur - UP34,L5P,TVS MOTOR COMPANY LTD,0,1,3,8,13,11,3,39,0,0,0
