State,RTO,Variant,OEM,2025-01-31,2025-02-28,2025-03-31,2025-04-30,2025-05-31,2025-06-30,2025-07-31,2025-08-31,2025-09-30,2025-10-31,2025-11-30
Uttar Pradesh,Kanpur Dehat - UP77,L5P,BAJAJ AUTO LTD,5,2,1,4,17,11,0,40,0,0,0
Uttar Pradesh,Kanpur Dehat - UP77,L5P,EULER MOTORS PVT LTD,0,0,0,0,1,1,0,2,0,0,0
Uttar Pradesh,Kanpur Dehat - UP77,L5P,MAHINDRA LAST MILE MOBILITY LTD,6,7,5,13,2,12,0,45,0,0,0
Uttar Pradesh,Kanpur Dehat - UP77,L5P,OMEGA SEIKI PVT LTD,1,0,0,0,0,0,0,1,0,0,0
Uttar Pradesh,Kanpur Dehat - UP77,L5P,PIAGGIO VEHICLES PVT LTD,0,0,0,0,1,0,0,1,0,0,0
Uttar Pradesh,Kanpur Dehat - UP77,L5P,TI CLEAN MOBILITY PVT LTD,0,0,0,2,2,0,0,4,0,0,0
Uttar Pradesh,Kanpur Dehat - UP77,L5P,TVS MOTOR COMPANY LTD,0,0,0,4,4,8,0,16,0,0,0
