State,RTO,Variant,OEM,2025-01-31,2025-02-28,2025-03-31,2025-04-30,2025-05-31,2025-06-30,2025-07-31,2025-08-31,2025-09-30,2025-10-31,2025-11-30
Uttar Pradesh,BANDARTO - UP90,E2W,BAJAJ AUTO LTD,4,5,2,8,5,6,0,30,0,0,0
Uttar Pradesh,BANDARTO - UP90,E2W,GREAVES ELECTRIC MOBILITY PVT LTD,0,0,1,0,0,0,0,1,0,0,0
Uttar Pradesh,BANDARTO - UP90,E2W,HERO MOTOCORP LTD,0,1,2,0,1,1,0,5,0,0,0
Uttar Pradesh,BANDARTO - UP90,E2W,KLB KOMAKI PVT LTD,0,1,1,0,0,0,0,2,0,0,0
Uttar Pradesh,BANDARTO - UP90,E2W,OLA ELECTRIC TECHNOLOGIES PVT LTD,3,0,6,2,3,5,0,19,0,0,0
Uttar Pradesh,BANDARTO - UP90,E2W,SOKUDO ELECTRIC INDIA PVT LTD,1,0,0,0,0,0,0,1,0,0,0
Uttar Pradesh,BANDARTO - UP90,E2W,TVS MOTOR COMPANY LTD,0,0,0,0,1,1,0,2,0,0,0
